<?xml version="1.0" encoding="UTF-8"?>

<xs:schema xmlns:xs="http://www.w3.org/2001/XMLSchema">

	<xs:element name="Company">        
		<xs:complexType>
			<xs:sequence>
				<xs:element name="Employee" maxOccurs="unbounded">
					<xs:complexType>
						<xs:sequence>
						    <xs:element name="id" type="xs:integer"/>
							<xs:element name="Emp-name" type="xs:string"/>
							<xs:element name="Emp-age" type="xs:integer"/>
							<xs:element name="Emp-salary" type="s_sal"/>
							<xs:element name="Emp-emailid" type="xs:string"/> 
							<xs:element name="Emp-Phonenum" type="xs:integer"/>
							<xs:element name="Emp-designation" type="xs:string"/>
						</xs:sequence>
                    </xs:complexType>
                </xs:element>
		<xs:simpleType name="s_sal">
    	<xs:restriction base="xs:integer">
    	<xs:minInclusive value="50000"/>
    	<xs:maxExclusive value="100000"/>
    </xs:restriction>
             </xs:sequence>
        </xs:complexType>
    </xs:element>
</xs:schema>
